{
  "opportunityId": "OPP-DEMO-001",
  "claims": [
    {
      "claimId": "CLM-DEMO-001",
      "text": "Demo operator completed a synthetic research project about trustworthy career decision workflows.",
      "sourceClaimTextHash": "sha256:bcde5d3be7d4177ab2d361c05645764a210b45a42563dffc8fd4fb9400480aa8",
      "evidenceStatus": "verified",
      "sourcePointer": "examples/demo-profile/source.md#project",
      "publiclyAssertable": true
    }
  ],
  "documents": [
    {
      "kind": "cv",
      "path": "examples/demo-profile/source.md",
      "contentHash": "sha256:439fab98379b83f22dffb779fb5588dea0d3861ac9b65d6b2a99d5f88687188e"
    }
  ],
  "tosCompliant": true,
  "generatedAt": "2026-07-04T00:00:00.000Z",
  "packetHash": "sha256:cbc8ff03a09c8a3ba0b2fa4dff071efd8e2ef0a5e1e653755c5806444f2b9be5",
  "approvalRequired": true
}
